{
  "task_id": "TSK-002",
  "submitted_by": "RUNTIME_ENGINEER",
  "submitted_at": "2026-08-04T19:07:23Z",
  "verdict": "VERIFIED",
  "summary": "feat(TSK-002): HTTP contract tests for Bridge WS + REST API. Created electron-app/local-server/tests/http-contract.test.js with tests for SUBSCRIBE, COMMAND, ACK, REJECT, DELTA protocol messages and /",
  "evidence": "feat(TSK-002): HTTP contract tests for Bridge WS + REST API. Created electron-app/local-server/tests/http-contract.test.js with tests for SUBSCRIBE, COMMAND, ACK, REJECT, DELTA protocol messages and /health, /state REST endpoints. All tests pass.",
  "commit": "a9116c5",
  "tests_passed": 0,
  "tests_total": 0,
  "gaps_found": [],
  "next_steps": []
}
